{
  "$schema": "https://json-schema.org/draft/2020-12/schema",
  "$id": "https://github.com/SidCorp-co/codemap/spec/schema/codemap.schema.json",
  "title": "codemap/1 registry",
  "description": "Closes the vocabulary of flow names and scopes enforcement. Steps are never declared here — they are derived from the code (SPEC.md §1.1, §8).",
  "type": "object",
  "additionalProperties": false,
  "required": ["specVersion"],
  "properties": {
    "specVersion": {
      "const": "codemap/1",
      "description": "A tool older than the registry refuses to run (§9)."
    },
    "flows": {
      "type": "array",
      "description": "Declared flow names. A cm:flow naming anything absent from this list is CM101.",
      "items": {
        "type": "object",
        "additionalProperties": false,
        "required": ["name"],
        "properties": {
          "name": { "type": "string", "pattern": "^[a-z0-9][a-z0-9-]*$" },
          "description": { "type": "string" }
        }
      }
    },
    "externals": {
      "type": "array",
      "description": "Out-of-tree systems a cm:edge may target as external:<name>/<path>. Only the NAME is verifiable — the path inside it is not in the tree, so nothing checks it (SPEC.md §4, §8). An undeclared name is CM107.",
      "items": {
        "type": "object",
        "additionalProperties": false,
        "required": ["name"],
        "properties": {
          "name": { "type": "string", "pattern": "^[a-z0-9][a-z0-9-]*$" },
          "description": { "type": "string" }
        }
      }
    },
    "enforce": {
      "type": "object",
      "additionalProperties": false,
      "properties": {
        "grammar": { "type": "boolean", "default": true },
        "advisory": { "type": "boolean", "default": false, "description": "Run the advisory tier (CM301) in a --tier all run. Warning-only and never gating; off by default because its false-positive rate is unmeasured (SPEC.md §7.1)." },
        "drain": { "type": "boolean", "default": true, "description": "Raise CM013 on a run with a base revision: a file whose code changed while none of its frozen prose debt fell (SPEC.md §8). On by default — it is the only path by which the baseline drains from work that was happening anyway." },
        "symbolForms": { "type": "array", "items": { "type": "string", "enum": ["camel", "const", "snake"] }, "default": ["camel"], "description": "Which shapes of backticked token in a cm:guard/cm:why body CM108 holds to existing (SPEC.md §7.2). camel is lowerCamelCase and the only one on by default; const is SCREAMING_SNAKE with an underscore and snake is lower_snake with one, and both are off because a platform error code and a database table have those exact shapes." },
        "include": { "type": "array", "items": { "type": "string" }, "default": ["**"] },
        "exclude": { "type": "array", "items": { "type": "string" } },
        "headerMaxLines": { "type": "integer", "minimum": 1, "default": 20 }
      }
    },
    "languages": {
      "type": "object",
      "description": "Per-language overrides, keyed by profile id: ts, sfc, go, php, py, rust, sql, sh, yaml, docker.",
      "additionalProperties": {
        "type": "object",
        "additionalProperties": false,
        "properties": {
          "enforce": { "type": "boolean" },
          "docPolicy": { "enum": ["banned", "allowed", "required-on-exported"] }
        }
      }
    }
  }
}
